label,message,tokens,message_length,word_count,avg_word_length
1,customer loyalty offerthe new nokia mobile from only at txtauction txt word start to no get yours now tctxt tc pmtmsg,"['customer', 'loyalty', 'offerthe', 'new', 'nokia', 'mobile', 'txtauction', 'txt', 'word', 'start', 'get', 'tctxt', 'tc', 'pmtmsg']",117,21,5.571428571428571
0,then any special there,['special'],22,4,5.5
0,im now but have to wait till for the bus to pick me,"['im', 'wait', 'till', 'bus', 'pick']",51,13,3.923076923076923
1,orange brings you ringtones from all time chart heroes with a free hit each week go to ringtones pics on wap to stop receiving these tips reply stop,"['orange', 'brings', 'ringtones', 'time', 'chart', 'heroes', 'free', 'hit', 'week', 'go', 'ringtones', 'pics', 'wap', 'stop', 'receiving', 'tips', 'reply', 'stop']",148,28,5.285714285714286
0,where you what happen,['happen'],21,4,5.25
0,ill see but prolly yeah,"['ill', 'see', 'prolly', 'yeah']",23,5,4.6
1,gent we are trying to contact you last weekends draw shows that you won a prize guaranteed call claim code k valid hrs only ppm,"['gent', 'trying', 'contact', 'last', 'weekends', 'draw', 'shows', 'prize', 'guaranteed', 'call', 'claim', 'code', 'k', 'valid', 'hrs', 'ppm']",127,25,5.08
0,ha you dont know either i did a a clever but simple thing with pears the other day perfect for christmas,"['ha', 'dont', 'know', 'either', 'clever', 'simple', 'thing', 'pears', 'day', 'perfect', 'christmas']",104,21,4.9523809523809526
0,hi princess thank you for the pics you are very pretty how are you,"['hi', 'princess', 'thank', 'pics', 'pretty']",66,14,4.714285714285714
0,how much is torch in ja,"['much', 'torch', 'ja']",23,6,3.8333333333333335
0,yeah you should i think you can use your gt atm now to register not sure but if theres anyway i can help let me know but when you do be sure you are ready,"['yeah', 'think', 'use', 'gt', 'atm', 'register', 'sure', 'theres', 'anyway', 'help', 'let', 'know', 'sure', 'ready']",154,35,4.4
0,im still looking for a car to buy and have not gone the driving test yet,"['im', 'still', 'looking', 'car', 'buy', 'gone', 'driving', 'test', 'yet']",72,16,4.5
0,gud gudk chikku tke care sleep well gud nyt,"['gud', 'gudk', 'chikku', 'tke', 'care', 'sleep', 'well', 'gud', 'nyt']",43,9,4.777777777777778
0,hi my love how goes that day fuck this morning i woke and dropped my cell on the way down the stairs but it seems alright phews i miss you,"['hi', 'love', 'goes', 'day', 'fuck', 'morning', 'woke', 'dropped', 'cell', 'way', 'stairs', 'seems', 'alright', 'phews', 'miss']",138,30,4.6
1,tddnewsletteremccouk more games from thedailydraw dear helen dozens of free games with great prizeswith,"['tddnewsletteremccouk', 'games', 'thedailydraw', 'dear', 'helen', 'dozens', 'free', 'games', 'great', 'prizeswith']",103,14,7.357142857142857
0,those cocksuckers if it makes you feel better ipads are worthless garbage novelty items and you should feel bad for even wanting one,"['cocksuckers', 'makes', 'feel', 'better', 'ipads', 'worthless', 'garbage', 'novelty', 'items', 'feel', 'bad', 'even', 'wanting', 'one']",132,23,5.739130434782608
0,nothing but we jus tot u would ask cos u ba gua but we went mt faber yest yest jus went out already mah so today not going out jus call lor,"['nothing', 'jus', 'tot', 'u', 'would', 'ask', 'cos', 'u', 'ba', 'gua', 'went', 'mt', 'faber', 'yest', 'yest', 'jus', 'went', 'already', 'mah', 'today', 'going', 'jus', 'call', 'lor']",139,32,4.34375
0,a boy loved a gal he propsd bt she didnt mind he gv lv lttrs bt her frnds threw thm again d boy decided aproach d gal dt time a truck was speeding towards d gal wn it was about hit d girld boy ran like hell n saved her she asked hw cn u run so fast d boy replied boost is d secret of my energy n instantly d girl shouted our energy n thy lived happily gthr drinking boost evrydy moral of d story i hv free msgsd gud ni,"['boy', 'loved', 'gal', 'propsd', 'bt', 'didnt', 'mind', 'gv', 'lv', 'lttrs', 'bt', 'frnds', 'threw', 'thm', 'boy', 'decided', 'aproach', 'gal', 'dt', 'time', 'truck', 'speeding', 'towards', 'gal', 'wn', 'hit', 'girld', 'boy', 'ran', 'like', 'hell', 'n', 'saved', 'asked', 'hw', 'cn', 'u', 'run', 'fast', 'boy', 'replied', 'boost', 'secret', 'energy', 'n', 'instantly', 'girl', 'shouted', 'energy', 'n', 'thy', 'lived', 'happily', 'gthr', 'drinking', 'boost', 'evrydy', 'moral', 'story', 'hv', 'free', 'msgsd', 'gud', 'ni']",418,93,4.494623655913978
0,unlimited texts limited minutes,"['unlimited', 'texts', 'limited', 'minutes']",31,4,7.75
0,o turns out i had stereo love on mi phone under the unknown album,"['turns', 'stereo', 'love', 'mi', 'phone', 'unknown', 'album']",65,14,4.642857142857143
0,ok set let u noe e details later,"['ok', 'set', 'let', 'u', 'noe', 'e', 'details', 'later']",32,8,4.0
0,tell me theyre female v howre you throwing in were deciding what all to get now,"['tell', 'theyre', 'female', 'v', 'howre', 'throwing', 'deciding', 'get']",79,16,4.9375
0,great have a safe trip dont panic surrender all,"['great', 'safe', 'trip', 'dont', 'panic', 'surrender']",47,9,5.222222222222222
0,well the weather in calis great but its complexities are great you need a car to move freely its taxes are outrageous but all in all its a great place the sad part is i missing home,"['well', 'weather', 'calis', 'great', 'complexities', 'great', 'need', 'car', 'move', 'freely', 'taxes', 'outrageous', 'great', 'place', 'sad', 'part', 'missing', 'home']",181,37,4.891891891891892
0,oh unintentionally not bad timing great fingers the trains play along will give fifteen min warning,"['oh', 'unintentionally', 'bad', 'timing', 'great', 'fingers', 'trains', 'play', 'along', 'give', 'fifteen', 'min', 'warning']",99,16,6.1875
0,please protect yourself from ethreats sib never asks for sensitive information like passwordsatmsms pin thru email never share your password with anybody,"['please', 'protect', 'ethreats', 'sib', 'never', 'asks', 'sensitive', 'information', 'like', 'passwordsatmsms', 'pin', 'thru', 'email', 'never', 'share', 'password', 'anybody']",153,22,6.954545454545454
0,alex knows a guy who sells mids but hes down in south tampa and i dont think i could set it up before like,"['alex', 'knows', 'guy', 'sells', 'mids', 'hes', 'south', 'tampa', 'dont', 'think', 'could', 'set', 'like']",106,24,4.416666666666667
0,no problem how are you doing,['problem'],28,6,4.666666666666667
0,good afternoon my boytoy how are you feeling today better i hope are you being my good boy are you my obedient slave do you please your queen,"['good', 'afternoon', 'boytoy', 'feeling', 'today', 'better', 'hope', 'good', 'boy', 'obedient', 'slave', 'please', 'queen']",141,28,5.035714285714286
0,fine do you remember me,"['fine', 'remember']",23,5,4.6
0,how much i gave to you morning,"['much', 'gave', 'morning']",30,7,4.285714285714286
0,ya toldshe was asking wats matter,"['ya', 'toldshe', 'asking', 'wats', 'matter']",33,6,5.5
0,yes but i dont care i need you bad princess,"['yes', 'dont', 'care', 'need', 'bad', 'princess']",43,10,4.3
0,rose for redred for bloodblood for heartheart for u but u for me send tis to all ur friends including me if u like me if u get back u r poor in relation u need some to support u r frnd many some luvs u some is praying god to marry u try it,"['rose', 'redred', 'bloodblood', 'heartheart', 'u', 'u', 'send', 'tis', 'ur', 'friends', 'including', 'u', 'like', 'u', 'get', 'back', 'u', 'r', 'poor', 'relation', 'u', 'need', 'support', 'u', 'r', 'frnd', 'many', 'luvs', 'u', 'praying', 'god', 'marry', 'u', 'try']",239,55,4.345454545454546
0,sweet heart how are you,"['sweet', 'heart']",23,5,4.6
0,super dagood replacement for murali,"['super', 'dagood', 'replacement', 'murali']",35,5,7.0
0,i surely dont forgot to comei will always be in touch in with you,"['surely', 'dont', 'forgot', 'comei', 'always', 'touch']",65,14,4.642857142857143
0,in cbe in chennai,"['cbe', 'chennai']",17,4,4.25
0,hope ur head doesnt hurt much am ploughing my way through a pile of ironing staying in with a chinky tonight come round if you like,"['hope', 'ur', 'head', 'doesnt', 'hurt', 'much', 'ploughing', 'way', 'pile', 'ironing', 'staying', 'chinky', 'tonight', 'come', 'round', 'like']",131,26,5.038461538461538
0,no but we found a diff farm shop to buy some cheese on way back now can i call in,"['found', 'diff', 'farm', 'shop', 'buy', 'cheese', 'way', 'back', 'call']",81,20,4.05
0,hiya stu wot u up im in so much truble at home at moment evone hates me even u wot the hell av i done now y wont u just tell me text bck please luv dan,"['hiya', 'stu', 'wot', 'u', 'im', 'much', 'truble', 'home', 'moment', 'evone', 'hates', 'even', 'u', 'wot', 'hell', 'av', 'done', 'wont', 'u', 'tell', 'text', 'bck', 'please', 'luv', 'dan']",151,37,4.081081081081081
0,happy birthday to youdearwith lots of loverakhesh nri,"['happy', 'birthday', 'youdearwith', 'lots', 'loverakhesh', 'nri']",53,8,6.625
0,got wat to buy tell us then no need to come in again,"['got', 'wat', 'buy', 'tell', 'us', 'need', 'come']",52,13,4.0
0,r u saying i should re order the slippers cos i had to pay for returning it,"['r', 'u', 'saying', 'order', 'slippers', 'cos', 'pay', 'returning']",75,17,4.411764705882353
0,oh you got many responsibilities,"['oh', 'got', 'many', 'responsibilities']",32,5,6.4
0,i absolutely love south park i only recently started watching the office,"['absolutely', 'love', 'south', 'park', 'recently', 'started', 'watching', 'office']",72,12,6.0
0,arngd marriage is while u r walkin unfortuntly a snake bites u bt love marriage is dancing in frnt of d snake amp sayin bite me bite me,"['arngd', 'marriage', 'u', 'r', 'walkin', 'unfortuntly', 'snake', 'bites', 'u', 'bt', 'love', 'marriage', 'dancing', 'frnt', 'snake', 'amp', 'sayin', 'bite', 'bite']",135,28,4.821428571428571
0,it took mr owl licks,"['took', 'mr', 'owl', 'licks']",20,5,4.0
0,which is why i never wanted to tell you any of this which is why im so short with you and onedge as of late,"['never', 'wanted', 'tell', 'im', 'short', 'onedge', 'late']",107,25,4.28
0,watching ajith film ah,"['watching', 'ajith', 'film', 'ah']",22,4,5.5
0,it should take about ltgt min,"['take', 'ltgt', 'min']",29,6,4.833333333333333
1,congrats year special cinema pass for is yours call now c suprman v matrix starwars etc all free bxipwe pm dont miss out,"['congrats', 'year', 'special', 'cinema', 'pass', 'call', 'c', 'suprman', 'v', 'matrix', 'starwars', 'etc', 'free', 'bxipwe', 'pm', 'dont', 'miss']",120,23,5.217391304347826
0,hows that watch resizing,"['hows', 'watch', 'resizing']",24,4,6.0
0,well the general price is ltgt oz let me know ifwhenhow much you want,"['well', 'general', 'price', 'ltgt', 'oz', 'let', 'know', 'ifwhenhow', 'much', 'want']",69,14,4.928571428571429
0,yep at dereks house now see you sunday lt,"['yep', 'dereks', 'house', 'see', 'sunday', 'lt']",41,9,4.555555555555555
0,what i told before i tell stupid hear after i wont tell anything to you you dad called to my brother and spoken not with me,"['told', 'tell', 'stupid', 'hear', 'wont', 'tell', 'anything', 'dad', 'called', 'brother', 'spoken']",123,26,4.730769230769231
0,whats up bruv hope you had a great break do have a rewarding semester,"['whats', 'bruv', 'hope', 'great', 'break', 'rewarding', 'semester']",69,14,4.928571428571429
0,what class of ltgt reunion,"['class', 'ltgt', 'reunion']",26,5,5.2
1,get lions england tone reply lionm mono or lionp poly more go wwwringtonescouk the original n best tones gbp network operator rates apply,"['get', 'lions', 'england', 'tone', 'reply', 'lionm', 'mono', 'lionp', 'poly', 'go', 'wwwringtonescouk', 'original', 'n', 'best', 'tones', 'gbp', 'network', 'operator', 'rates', 'apply']",137,23,5.956521739130435
0,going on nothing greatbye,"['going', 'nothing', 'greatbye']",25,4,6.25
0,good morning plz call me sir,"['good', 'morning', 'plz', 'call', 'sir']",28,6,4.666666666666667
0,ok ksry i knw sivatats y i askd,"['ok', 'ksry', 'knw', 'sivatats', 'askd']",31,8,3.875
0,no way im going back there,"['way', 'im', 'going', 'back']",26,6,4.333333333333333
0,for real when u getting on yo i only need more tickets and one more jacket and im done i already used all my multis,"['real', 'u', 'getting', 'yo', 'need', 'tickets', 'one', 'jacket', 'im', 'done', 'already', 'used', 'multis']",115,25,4.6
0,youre gonna have to be way more specific than that,"['youre', 'gon', 'na', 'way', 'specific']",50,10,5.0
0,i will vote for wherever my heart guides me,"['vote', 'wherever', 'heart', 'guides']",43,9,4.777777777777778
0,going to join tomorrow,"['going', 'join', 'tomorrow']",22,4,5.5
0,for real tho this sucks i cant even cook my whole electricity is out and im hungry,"['real', 'tho', 'sucks', 'cant', 'even', 'cook', 'whole', 'electricity', 'im', 'hungry']",82,17,4.823529411764706
0,give one miss from that number please,"['give', 'one', 'miss', 'number', 'please']",37,7,5.285714285714286
1,free entry into our weekly comp just send the word win to now tc wwwtxttowincouk,"['free', 'entry', 'weekly', 'comp', 'send', 'word', 'win', 'tc', 'wwwtxttowincouk']",80,15,5.333333333333333
0,lol nah wasnt too bad thanks its good to b home but its been quite a reality check hows ur day been did u do anything with website,"['lol', 'nah', 'wasnt', 'bad', 'thanks', 'good', 'b', 'home', 'quite', 'reality', 'check', 'hows', 'ur', 'day', 'u', 'anything', 'website']",130,28,4.642857142857143
1,customer service announcement we recently tried to make a delivery to you but were unable to do so please call to reschedule ref,"['customer', 'service', 'announcement', 'recently', 'tried', 'make', 'delivery', 'unable', 'please', 'call', 'reschedule', 'ref']",128,23,5.565217391304348
0,this message is from a great doctor in india do not drink appy fizz it contains cancer causing age,"['message', 'great', 'doctor', 'india', 'drink', 'appy', 'fizz', 'contains', 'cancer', 'causing', 'age']",98,19,5.157894736842105
0,i am thinking of going down to reg for pract lessons flung my advance haha wat time u going,"['thinking', 'going', 'reg', 'pract', 'lessons', 'flung', 'advance', 'haha', 'wat', 'time', 'u', 'going']",91,19,4.7894736842105265
0,alrite jod hows the revision goin keris bin doin a smidgin n e way u wanna cum over after collegexx,"['alrite', 'jod', 'hows', 'revision', 'goin', 'keris', 'bin', 'doin', 'smidgin', 'n', 'e', 'way', 'u', 'wan', 'na', 'cum', 'collegexx']",99,20,4.95
0,i probably wont eat at all today i think im gonna pop how was your weekend did u miss me,"['probably', 'wont', 'eat', 'today', 'think', 'im', 'gon', 'na', 'pop', 'weekend', 'u', 'miss']",88,20,4.4
0,i wont do anything de,"['wont', 'anything', 'de']",21,5,4.2
0,wherres my boytoy,"['wherres', 'boytoy']",17,3,5.666666666666667
0,many times we lose our best ones bcoz we are,"['many', 'times', 'lose', 'best', 'ones', 'bcoz']",44,10,4.4
0,what time do u get out,"['time', 'u', 'get']",22,6,3.6666666666666665
0,hi frnd which is best way to avoid missunderstding wit our beloved ones,"['hi', 'frnd', 'best', 'way', 'avoid', 'missunderstding', 'wit', 'beloved', 'ones']",71,13,5.461538461538462
0,hard but true how much you show amp express your love to someonethat much it will hurt when they leave you or you get seperatedud evening,"['hard', 'true', 'much', 'show', 'amp', 'express', 'love', 'someonethat', 'much', 'hurt', 'leave', 'get', 'seperatedud', 'evening']",137,26,5.269230769230769
0,aight do you still want to get money,"['aight', 'still', 'want', 'get', 'money']",36,8,4.5
0,you are right meanwhile hows project twins comin up,"['right', 'meanwhile', 'hows', 'project', 'twins', 'comin']",51,9,5.666666666666667
0,still at west coast haiz ll take forever to come back,"['still', 'west', 'coast', 'haiz', 'take', 'forever', 'come', 'back']",53,11,4.818181818181818
0,yeah just open chat and click friend lists then make the list easy as pie,"['yeah', 'open', 'chat', 'click', 'friend', 'lists', 'make', 'list', 'easy', 'pie']",73,15,4.866666666666666
0,takin linear algebra today,"['takin', 'linear', 'algebra', 'today']",26,4,6.5
1,your next amazing xxx picsfree video will be sent to you enjoy if one vid is not enough for day text back the keyword picsfree to get the next video,"['next', 'amazing', 'xxx', 'picsfree', 'video', 'sent', 'enjoy', 'one', 'vid', 'enough', 'day', 'text', 'back', 'keyword', 'picsfree', 'get', 'next', 'video']",148,30,4.933333333333334
0,i love working from home,"['love', 'working', 'home']",24,5,4.8
0,wat time liao where still got,"['wat', 'time', 'liao', 'still', 'got']",29,6,4.833333333333333
0,im on the bus love you,"['im', 'bus', 'love']",22,6,3.6666666666666665
0,sorry da i gone mad so many pending works what to do,"['sorry', 'da', 'gone', 'mad', 'many', 'pending', 'works']",52,12,4.333333333333333
0,sorry i missed your call can you please call back,"['sorry', 'missed', 'call', 'please', 'call', 'back']",49,10,4.9
0,yup but not studying surfing lor im in e lazy mode today,"['yup', 'studying', 'surfing', 'lor', 'im', 'e', 'lazy', 'mode', 'today']",56,12,4.666666666666667
0,pls help me tell ashley that i cant find her number oh,"['pls', 'help', 'tell', 'ashley', 'cant', 'find', 'number', 'oh']",54,12,4.5
0,missed your call cause i was yelling at scrappy miss u cant wait for u to come home im so lonely today,"['missed', 'call', 'cause', 'yelling', 'scrappy', 'miss', 'u', 'cant', 'wait', 'u', 'come', 'home', 'im', 'lonely', 'today']",102,22,4.636363636363637
0,what hello wats talks email address,"['hello', 'wats', 'talks', 'email', 'address']",35,6,5.833333333333333
0,hey darlin i can pick u up at college if u tell me wen where mt love pete xx,"['hey', 'darlin', 'pick', 'u', 'college', 'u', 'tell', 'wen', 'mt', 'love', 'pete', 'xx']",76,19,4.0
0,what are youdoing later sar xxx,"['youdoing', 'later', 'sar', 'xxx']",31,6,5.166666666666667
0,should i buy him a blackberry bold or torch should i buy him new or used let me know plus are you saying i should buy the ltgt g wifi ipad and what are you saying about the about the ltgt g,"['buy', 'blackberry', 'bold', 'torch', 'buy', 'new', 'used', 'let', 'know', 'plus', 'saying', 'buy', 'ltgt', 'g', 'wifi', 'ipad', 'saying', 'ltgt', 'g']",189,42,4.5
0,no my blankets are sufficient thx,"['blankets', 'sufficient', 'thx']",33,6,5.5
0,no ill meet you in the library,"['ill', 'meet', 'library']",30,7,4.285714285714286
0,our ride equally uneventful not too many of those pesky cyclists around at that time of night,"['ride', 'equally', 'uneventful', 'many', 'pesky', 'cyclists', 'around', 'time', 'night']",93,17,5.470588235294118
0,ah well that confuses things doesnt it i thought was friends with now maybe i did the wrong thing but i already sort of invited tho he may not come cos of money,"['ah', 'well', 'confuses', 'things', 'doesnt', 'thought', 'friends', 'maybe', 'wrong', 'thing', 'already', 'sort', 'invited', 'tho', 'may', 'come', 'cos', 'money']",160,33,4.848484848484849
0,call me da i am waiting for your call,"['call', 'da', 'waiting', 'call']",37,9,4.111111111111111
0,what i meant to say is cant wait to see u again getting bored of this bridgwater banter,"['meant', 'say', 'cant', 'wait', 'see', 'u', 'getting', 'bored', 'bridgwater', 'banter']",87,18,4.833333333333333
0,yeah sure thing mate haunt got all my stuff sorted but im going sound anyway promoting hex for by the way who is this dont know number joke,"['yeah', 'sure', 'thing', 'mate', 'haunt', 'got', 'stuff', 'sorted', 'im', 'going', 'sound', 'anyway', 'promoting', 'hex', 'way', 'dont', 'know', 'number', 'joke']",139,28,4.964285714285714
0,im not coming over do whatever you want,"['im', 'coming', 'whatever', 'want']",39,8,4.875
0,please da call me any mistake from my side sorry da pls da goto doctor,"['please', 'da', 'call', 'mistake', 'side', 'sorry', 'da', 'pls', 'da', 'goto', 'doctor']",70,15,4.666666666666667
0,hey do u fancy meetin me at at cha hav a lil beverage on me if not txt or ring me and we can meet up lr quite tired got in at vpist love pete x x x,"['hey', 'u', 'fancy', 'meetin', 'cha', 'hav', 'lil', 'beverage', 'txt', 'ring', 'meet', 'lr', 'quite', 'tired', 'got', 'vpist', 'love', 'pete', 'x', 'x', 'x']",147,38,3.8684210526315788
0,do u noe how send files between computers,"['u', 'noe', 'send', 'files', 'computers']",41,8,5.125
0,but i haf enuff space got like mb,"['haf', 'enuff', 'space', 'got', 'like', 'mb']",33,8,4.125
0,id onluy matters when getting on from offcampus,"['id', 'onluy', 'matters', 'getting', 'offcampus']",47,8,5.875
0,watching tv now i got new job,"['watching', 'tv', 'got', 'new', 'job']",29,7,4.142857142857143
0,great i have to run now so ttyl,"['great', 'run', 'ttyl']",31,8,3.875
0,k makes sense btw carlos is being difficult so you guys are gonna smoke while i go pick up the second batch and get gas,"['k', 'makes', 'sense', 'btw', 'carlos', 'difficult', 'guys', 'gon', 'na', 'smoke', 'go', 'pick', 'second', 'batch', 'get', 'gas']",119,25,4.76
1,congratulations thanks to a good friend u have won the xmas prize claim is easy just call now only p per minute btnationalrate,"['congratulations', 'thanks', 'good', 'friend', 'u', 'xmas', 'prize', 'claim', 'easy', 'call', 'p', 'per', 'minute', 'btnationalrate']",126,23,5.478260869565218
0,how long does it take to get it,"['long', 'take', 'get']",31,8,3.875
0,ill probably be by tomorrow or even later tonight if somethings going on,"['ill', 'probably', 'tomorrow', 'even', 'later', 'tonight', 'somethings', 'going']",72,13,5.538461538461538
0,then its most likely called mittelschmertz google it if you dont have paracetamol dont worry it will go,"['likely', 'called', 'mittelschmertz', 'google', 'dont', 'paracetamol', 'dont', 'worry', 'go']",103,18,5.722222222222222
0,we confirm eating at esplanade,"['confirm', 'eating', 'esplanade']",30,5,6.0
0,yeah if we do have to get a random dude we need to change our info sheets to party ltgt never study just to be safe,"['yeah', 'get', 'random', 'dude', 'need', 'change', 'info', 'sheets', 'party', 'ltgt', 'never', 'study', 'safe']",115,26,4.423076923076923
0,my friends use to call the same,"['friends', 'use', 'call']",31,7,4.428571428571429
0,im home doc gave me pain meds says everything is fine,"['im', 'home', 'doc', 'gave', 'pain', 'meds', 'says', 'everything', 'fine']",53,11,4.818181818181818
0,god asked what is forgiveness a little child gave lovely reply it is d wonderful fruit that a tree gives when it is being hurt by a stone good night,"['god', 'asked', 'forgiveness', 'little', 'child', 'gave', 'lovely', 'reply', 'wonderful', 'fruit', 'tree', 'gives', 'hurt', 'stone', 'good', 'night']",148,30,4.933333333333334
0,therere some people by mu im at the table by lambda,"['therere', 'people', 'mu', 'im', 'table', 'lambda']",51,11,4.636363636363637
0,two teams waiting for some players,"['two', 'teams', 'waiting', 'players']",34,6,5.666666666666667
0,do you mind if i ask what happened you dont have to say if it is uncomfortable,"['mind', 'ask', 'happened', 'dont', 'say', 'uncomfortable']",78,17,4.588235294117647
0,where are youwhen wil you reach here,"['youwhen', 'wil', 'reach']",36,7,5.142857142857143
0,my no in luton ring me if ur around h,"['luton', 'ring', 'ur', 'around', 'h']",37,10,3.7
0,mmm fuck merry christmas to me,"['mmm', 'fuck', 'merry', 'christmas']",30,6,5.0
0,can call me at to make sure dat ive woken up,"['call', 'make', 'sure', 'dat', 'ive', 'woken']",44,11,4.0
0,k want us to come by now,"['k', 'want', 'us', 'come']",24,7,3.4285714285714284
0,i know you mood off today,"['know', 'mood', 'today']",25,6,4.166666666666667
0,hey you got any mail,"['hey', 'got', 'mail']",20,5,4.0
0,okey dokey ill be over in a bit just sorting some stuff out,"['okey', 'dokey', 'ill', 'bit', 'sorting', 'stuff']",59,13,4.538461538461538
0,probably not im almost out of gas and i get some cash tomorrow,"['probably', 'im', 'almost', 'gas', 'get', 'cash', 'tomorrow']",62,13,4.769230769230769
0,see the forwarding message for proof,"['see', 'forwarding', 'message', 'proof']",36,6,6.0
1,free msg ringtonefrom widelivecomindex wmlidbaeceffffirsttruejul,"['free', 'msg', 'ringtonefrom', 'widelivecomindex', 'wmlidbaeceffffirsttruejul']",64,5,12.8
0,can you use foreign stamps for whatever you send them off for,"['use', 'foreign', 'stamps', 'whatever', 'send']",61,12,5.083333333333333
0,understand his loss is my gain so do you work school,"['understand', 'loss', 'gain', 'work', 'school']",52,11,4.7272727272727275
0,thats fine ill bitch at you about it later then,"['thats', 'fine', 'ill', 'bitch', 'later']",47,10,4.7
0,i cant keep talking to people if am not sure i can pay them if they agree to price so pls tell me what you want to really buy and how much you are willing to pay,"['cant', 'keep', 'talking', 'people', 'sure', 'pay', 'agree', 'price', 'pls', 'tell', 'want', 'really', 'buy', 'much', 'willing', 'pay']",161,37,4.351351351351352
0,horrible u eat macs eat until u forgot abt me already rite u take so long reply i thk its more toot than b so b prepared now wat shall i eat,"['horrible', 'u', 'eat', 'macs', 'eat', 'u', 'forgot', 'abt', 'already', 'rite', 'u', 'take', 'long', 'reply', 'thk', 'toot', 'b', 'b', 'prepared', 'wat', 'shall', 'eat']",140,32,4.375
0,where are you what do you do how can you stand to be away from me doesnt your heart ache without me dont you wonder of me dont you crave me,"['stand', 'away', 'doesnt', 'heart', 'ache', 'without', 'dont', 'wonder', 'dont', 'crave']",139,31,4.483870967741935
