label,message,tokens,message_length,word_count,avg_word_length
0,im not driving raining then ill get caught at e mrt station lor,"['im', 'driving', 'raining', 'ill', 'get', 'caught', 'e', 'mrt', 'station', 'lor']",63,13,4.846153846153846
0,no dice art class thru thanks though any idea what time i should come tomorrow,"['dice', 'art', 'class', 'thru', 'thanks', 'though', 'idea', 'time', 'come', 'tomorrow']",78,15,5.2
0,hi the way i was with u day is the normal waythis is the real me ur uniquei hope i know u the rest of mylife hope u find wot was lost,"['hi', 'way', 'u', 'day', 'normal', 'waythis', 'real', 'ur', 'uniquei', 'hope', 'know', 'u', 'rest', 'mylife', 'hope', 'u', 'find', 'wot', 'lost']",133,32,4.15625
0,at the funeral home with audrey and dad,"['funeral', 'home', 'audrey', 'dad']",39,8,4.875
0,will be september by then,['september'],25,5,5.0
0,dun need to use dial up juz open da browser n surf,"['dun', 'need', 'use', 'dial', 'juz', 'open', 'da', 'browser', 'n', 'surf']",50,12,4.166666666666667
0,oh is it which brand,"['oh', 'brand']",20,5,4.0
0,gonna let me know cos comes bak from holiday that day is coming dontgettext me number,"['gon', 'na', 'let', 'know', 'cos', 'comes', 'bak', 'holiday', 'day', 'coming', 'dontgettext', 'number']",85,16,5.3125
0,so is there anything specific i should be doing with regards to jaklin or what because idk what the fuck,"['anything', 'specific', 'regards', 'jaklin', 'idk', 'fuck']",104,20,5.2
0,carlos took a while again we leave in a minute,"['carlos', 'took', 'leave', 'minute']",46,10,4.6
0,ltgt of pple marry with their lovers becz they hav gud undrstndng dat avoids problems i sent dis u u wil get gud news on friday by d person you like and tomorrow will be the best day of your life dont break this chain if you break you will suffer send this to ltgt frnds in ltgt mins whn u read,"['ltgt', 'pple', 'marry', 'lovers', 'becz', 'hav', 'gud', 'undrstndng', 'dat', 'avoids', 'problems', 'sent', 'dis', 'u', 'u', 'wil', 'get', 'gud', 'news', 'friday', 'person', 'like', 'tomorrow', 'best', 'day', 'life', 'dont', 'break', 'chain', 'break', 'suffer', 'send', 'ltgt', 'frnds', 'ltgt', 'mins', 'whn', 'u', 'read']",294,62,4.741935483870968
0,hi im sorry i missed your call can you pls call back,"['hi', 'im', 'sorry', 'missed', 'call', 'pls', 'call', 'back']",52,12,4.333333333333333
0,is she replying has boye changed his phone number,"['replying', 'boye', 'changed', 'phone', 'number']",49,9,5.444444444444445
0,anyway i dont think i can secure anything up here lemme know if you want me to drive down south and chill,"['anyway', 'dont', 'think', 'secure', 'anything', 'lem', 'know', 'want', 'drive', 'south', 'chill']",105,22,4.7727272727272725
0,k wat s tht incident,"['k', 'wat', 'tht', 'incident']",20,5,4.0
0,kthen come wenever u lik to come and also tel vikky to come by getting free time,"['kthen', 'come', 'wenever', 'u', 'lik', 'come', 'also', 'tel', 'vikky', 'come', 'getting', 'free', 'time']",80,17,4.705882352941177
1,double your mins txts on orange or price linerental motorola and sonyericsson with btooth freenokia free call mobileupd on oroptouthvd,"['double', 'mins', 'txts', 'orange', 'price', 'linerental', 'motorola', 'sonyericsson', 'btooth', 'freenokia', 'free', 'call', 'mobileupd', 'oroptouthvd']",134,20,6.7
0,i dun believe u i thk u told him,"['dun', 'believe', 'u', 'thk', 'u', 'told']",32,9,3.5555555555555554
1,urgent we are trying to contact you last weekends draw shows that you have won a prize guaranteed call claim code k valid hours only,"['urgent', 'trying', 'contact', 'last', 'weekends', 'draw', 'shows', 'prize', 'guaranteed', 'call', 'claim', 'code', 'k', 'valid', 'hours']",132,25,5.28
0,moon has come to color your dreams stars to make them musical and my sms to give you warm and peaceful sleep good night,"['moon', 'come', 'color', 'dreams', 'stars', 'make', 'musical', 'sms', 'give', 'warm', 'peaceful', 'sleep', 'good', 'night']",119,24,4.958333333333333
0,are you plans with your family set in stone,"['plans', 'family', 'set', 'stone']",43,9,4.777777777777778
0,but thats on ebay it might be less elsewhere,"['thats', 'ebay', 'might', 'less', 'elsewhere']",44,9,4.888888888888889
0,k k sms chat with me,"['k', 'k', 'sms', 'chat']",20,6,3.3333333333333335
0,dear will call tmorrowpls accomodate,"['dear', 'call', 'tmorrowpls', 'accomodate']",36,5,7.2
0,he needs to stop going to bed and make with the fucking dealing,"['needs', 'stop', 'going', 'bed', 'make', 'fucking', 'dealing']",63,13,4.846153846153846
0,you have registered sinco as payee log in at icicibankcom and enter urn ltgt to confirm beware of frauds do not share or disclose urn to anyone,"['registered', 'sinco', 'payee', 'log', 'icicibankcom', 'enter', 'urn', 'ltgt', 'confirm', 'beware', 'frauds', 'share', 'disclose', 'urn', 'anyone']",143,27,5.296296296296297
0,cold dont be sad dear,"['cold', 'dont', 'sad', 'dear']",21,5,4.2
0,u guys never invite me anywhere,"['u', 'guys', 'never', 'invite', 'anywhere']",31,6,5.166666666666667
0,what do u want when i come backa beautiful necklace as a token of my heart for youthats what i will give but only to my wife of my likingbe that and seeno one can give you thatdont call mei will wait till i come,"['u', 'want', 'come', 'backa', 'beautiful', 'necklace', 'token', 'heart', 'youthats', 'give', 'wife', 'likingbe', 'seeno', 'one', 'give', 'thatdont', 'call', 'mei', 'wait', 'till', 'come']",211,45,4.688888888888889
0,this phone has the weirdest auto correct,"['phone', 'weirdest', 'auto', 'correct']",40,7,5.714285714285714
0,you still coming tonight,"['still', 'coming', 'tonight']",24,4,6.0
0,company is very goodenvironment is terrific and food is really nice,"['company', 'goodenvironment', 'terrific', 'food', 'really', 'nice']",67,11,6.090909090909091
0,why tired what special there you had,"['tired', 'special']",36,7,5.142857142857143
0,are you coming to day for class,"['coming', 'day', 'class']",31,7,4.428571428571429
0,ugh my leg hurts musta overdid it on mon,"['ugh', 'leg', 'hurts', 'musta', 'overdid', 'mon']",40,9,4.444444444444445
0,dude just saw a parked car with its sunroof popped up sux,"['dude', 'saw', 'parked', 'car', 'sunroof', 'popped', 'sux']",57,12,4.75
0,it wont b until as trying sort house out is that ok,"['wont', 'b', 'trying', 'sort', 'house', 'ok']",51,12,4.25
1,text get more ringtones logos and games from wwwtxtcom questions infotxtcouk,"['text', 'get', 'ringtones', 'logos', 'games', 'wwwtxtcom', 'questions', 'infotxtcouk']",76,11,6.909090909090909
0,im home my love if your still awake loving kiss,"['im', 'home', 'love', 'still', 'awake', 'loving', 'kiss']",47,10,4.7
0,men like shorter ladies gaze up into his eyes,"['men', 'like', 'shorter', 'ladies', 'gaze', 'eyes']",45,9,5.0
0,lol wtf random btw is that your lunch break,"['lol', 'wtf', 'random', 'btw', 'lunch', 'break']",43,9,4.777777777777778
0,jolly good by the way will give u tickets for sat eve speak before then x,"['jolly', 'good', 'way', 'give', 'u', 'tickets', 'sat', 'eve', 'speak', 'x']",73,16,4.5625
0,the house is on the water with a dock a boat rolled up with a newscaster who dabbles in jazz flute behind the wheel,"['house', 'water', 'dock', 'boat', 'rolled', 'newscaster', 'dabbles', 'jazz', 'flute', 'behind', 'wheel']",115,24,4.791666666666667
0,are you angry with me what happen dear,"['angry', 'happen', 'dear']",38,8,4.75
0,well done and luv ya all,"['well', 'done', 'luv', 'ya']",24,6,4.0
0,alrite,['alrite'],6,1,6.0
0,my computer just fried the only essential part we dont keep spares of because my fucking idiot roommates looovvve leaving the thing running on full ltgt,"['computer', 'fried', 'essential', 'part', 'dont', 'keep', 'spares', 'fucking', 'idiot', 'roommates', 'looovvve', 'leaving', 'thing', 'running', 'full', 'ltgt']",152,26,5.846153846153846
0,can u look me in da lib i got stuff havent finish yet,"['u', 'look', 'da', 'lib', 'got', 'stuff', 'havent', 'finish', 'yet']",53,13,4.076923076923077
0,come to mahal bus stop ltdecimalgt,"['come', 'mahal', 'bus', 'stop', 'ltdecimalgt']",34,6,5.666666666666667
0,tell her i said eat shit,"['tell', 'said', 'eat', 'shit']",24,6,4.0
0,am in gobi arts college,"['gobi', 'arts', 'college']",23,5,4.6
0,where is it is there any opening for mca,"['opening', 'mca']",40,9,4.444444444444445
1,knock knock txt whose there to to enter r weekly draw a gift voucher a store of yr choice tcs wwwtklscom age to stoptxtstopweek,"['knock', 'knock', 'txt', 'whose', 'enter', 'r', 'weekly', 'draw', 'gift', 'voucher', 'store', 'yr', 'choice', 'tcs', 'wwwtklscom', 'age', 'stoptxtstopweek']",127,24,5.291666666666667
0,just checking in on you really do miss seeing jeremiah do have a great month,"['checking', 'really', 'miss', 'seeing', 'jeremiah', 'great', 'month']",76,15,5.066666666666666
0,yeah i think my usual guys still passed out from last night if you get ahold of anybody let me know and ill throw down,"['yeah', 'think', 'usual', 'guys', 'still', 'passed', 'last', 'night', 'get', 'ahold', 'anybody', 'let', 'know', 'ill', 'throw']",118,25,4.72
0,k ill be sure to get up before noon and see whats what,"['k', 'ill', 'sure', 'get', 'noon', 'see', 'whats']",54,13,4.153846153846154
0,youve already got a flaky parent itsnot supposed to be the childs job to support the parentnot until theyre the ride age anyway im supposed to be there to support you and now ive hurt you unintentional but hurt nonetheless,"['youve', 'already', 'got', 'flaky', 'parent', 'itsnot', 'supposed', 'childs', 'job', 'support', 'parentnot', 'theyre', 'ride', 'age', 'anyway', 'im', 'supposed', 'support', 'ive', 'hurt', 'unintentional', 'hurt', 'nonetheless']",222,40,5.55
0,im on the snowboarding trip i was wondering if your planning to get everyone together befor we goa meet and greet kind of affair cheers,"['im', 'snowboarding', 'trip', 'wondering', 'planning', 'get', 'everyone', 'together', 'befor', 'goa', 'meet', 'greet', 'kind', 'affair', 'cheers']",135,25,5.4
0,hey kate hope ur ok will give u a buz wedlunch go outsomewhere adrink in towncud go watershd a bit ppl fromwrk will bthere love petexxx,"['hey', 'kate', 'hope', 'ur', 'ok', 'give', 'u', 'buz', 'wedlunch', 'go', 'outsomewhere', 'adrink', 'towncud', 'go', 'watershd', 'bit', 'ppl', 'fromwrk', 'bthere', 'love', 'petexxx']",135,26,5.1923076923076925
0,its a big difference ltgt versus ltgt every ltgt hrs,"['big', 'difference', 'ltgt', 'versus', 'ltgt', 'every', 'ltgt', 'hrs']",52,10,5.2
1,hi ya babe x u goten bout me scammers getting smartthough this is a regular vodafone no if you respond you get further prem rate msgsubscription other nos used also beware,"['hi', 'ya', 'babe', 'x', 'u', 'goten', 'bout', 'scammers', 'getting', 'smartthough', 'regular', 'vodafone', 'respond', 'get', 'prem', 'rate', 'msgsubscription', 'nos', 'used', 'also', 'beware']",171,31,5.516129032258065
0,hi dahow is the todays class,"['hi', 'dahow', 'todays', 'class']",28,6,4.666666666666667
0,jade its paul y didnt u txt me do u remember me from barmed i want talk u txt me,"['jade', 'paul', 'didnt', 'u', 'txt', 'u', 'remember', 'barmed', 'want', 'talk', 'u', 'txt']",80,20,4.0
0,pity was in mood for that soany other suggestions,"['pity', 'mood', 'soany', 'suggestions']",49,9,5.444444444444445
0,leaving to qatar tonite in search of an opportunityall went fastpls add me in ur prayers dearrakhesh,"['leaving', 'qatar', 'tonite', 'search', 'opportunityall', 'went', 'fastpls', 'add', 'ur', 'prayers', 'dearrakhesh']",100,17,5.882352941176471
0,hmmm i thought we said hours slave not you are late how should i punish you,"['hmmm', 'thought', 'said', 'hours', 'slave', 'late', 'punish']",75,16,4.6875
0,no need lar i go engin cos my sis at arts today,"['need', 'lar', 'go', 'engin', 'cos', 'sis', 'arts', 'today']",47,12,3.9166666666666665
0,wanna do some art d,"['wan', 'na', 'art']",19,5,3.8
0,hey for me there is no leave on friday wait i will ask my superior and tell you,"['hey', 'leave', 'friday', 'wait', 'ask', 'superior', 'tell']",79,18,4.388888888888889
0,my phone,['phone'],8,2,4.0
0,well am officially in a philosophical hole so if u wanna call am at home ready to be saved,"['well', 'officially', 'philosophical', 'hole', 'u', 'wan', 'na', 'call', 'home', 'ready', 'saved']",90,19,4.7368421052631575
1,want get laid tonight want real dogging locations sent direct ur mob join the uks largest dogging network bt txting gravel to nt eca pmsgp,"['want', 'get', 'laid', 'tonight', 'want', 'real', 'dogging', 'locations', 'sent', 'direct', 'ur', 'mob', 'join', 'uks', 'largest', 'dogging', 'network', 'bt', 'txting', 'gravel', 'nt', 'eca', 'pmsgp']",138,25,5.52
0,yup its at paragon i havent decided whether cut yet hee,"['yup', 'paragon', 'havent', 'decided', 'whether', 'cut', 'yet', 'hee']",55,11,5.0
0,sorry im not free,"['sorry', 'im', 'free']",17,4,4.25
0,me not waking up until in the afternoon sup,"['waking', 'afternoon', 'sup']",43,9,4.777777777777778
1,p per min to call germany from your bt line just p per min check planettalkinstantcom for info ts cs text stop to opt out,"['p', 'per', 'min', 'call', 'germany', 'bt', 'line', 'p', 'per', 'min', 'check', 'planettalkinstantcom', 'info', 'ts', 'cs', 'text', 'stop', 'opt']",121,25,4.84
0,ok then no need to tell me anything i am going to sleep good night,"['ok', 'need', 'tell', 'anything', 'going', 'sleep', 'good', 'night']",66,15,4.4
0,also are you bringing galileo or dobby,"['also', 'bringing', 'galileo', 'dobby']",38,7,5.428571428571429
0,jus telling u dat ill b leaving shanghai on st instead so well haf more time meet up cya,"['jus', 'telling', 'u', 'dat', 'ill', 'b', 'leaving', 'shanghai', 'st', 'instead', 'well', 'haf', 'time', 'meet', 'cya']",88,19,4.631578947368421
0,did u turn on the heater the heater was on and set to ltgt degrees,"['u', 'turn', 'heater', 'heater', 'set', 'ltgt', 'degrees']",66,15,4.4
0,jus finish my lunch on my way home lor i tot u dun wan stay in sch today,"['jus', 'finish', 'lunch', 'way', 'home', 'lor', 'tot', 'u', 'dun', 'wan', 'stay', 'sch', 'today']",72,18,4.0
0,i love u babe r u sure everything is alrite is he being an idiot txt bak girlie,"['love', 'u', 'babe', 'r', 'u', 'sure', 'everything', 'alrite', 'idiot', 'txt', 'bak', 'girlie']",79,18,4.388888888888889
0,and pls pls drink plenty plenty water,"['pls', 'pls', 'drink', 'plenty', 'plenty', 'water']",37,7,5.285714285714286
0,all write or wat,"['write', 'wat']",16,4,4.0
1,you have won a guaranteed cash or a prize to claim yr prize call our customer service representative on between ampm cost p,"['guaranteed', 'cash', 'prize', 'claim', 'yr', 'prize', 'call', 'customer', 'service', 'representative', 'ampm', 'cost', 'p']",123,23,5.3478260869565215
0,sure if i get an acknowledgement from you that its astoundingly tactless and generally faggy to demand a blood oath fo,"['sure', 'get', 'acknowledgement', 'astoundingly', 'tactless', 'generally', 'faggy', 'demand', 'blood', 'oath', 'fo']",118,21,5.619047619047619
0,dont give a monkeys wot they think and i certainly dont mind any friend of mineall that just dont sleep wiv that wud be annoyin,"['dont', 'give', 'monkeys', 'wot', 'think', 'certainly', 'dont', 'mind', 'friend', 'mineall', 'dont', 'sleep', 'wiv', 'wud', 'annoyin']",127,25,5.08
0,am on a train back from northampton so im afraid not,"['train', 'back', 'northampton', 'im', 'afraid']",52,11,4.7272727272727275
0,good no dont need any receiptswell done yes please tell whats her number i could ring her,"['good', 'dont', 'need', 'receiptswell', 'done', 'yes', 'please', 'tell', 'whats', 'number', 'could', 'ring']",89,17,5.235294117647059
0,thats cool where should i cum on you or in you,"['thats', 'cool', 'cum']",46,11,4.181818181818182
0,k im leaving soon be there a little after,"['k', 'im', 'leaving', 'soon', 'little']",41,9,4.555555555555555
0,prepare to be pounded every night,"['prepare', 'pounded', 'every', 'night']",33,6,5.5
0,sorry sir i will call you tomorrow senthilhsbc,"['sorry', 'sir', 'call', 'tomorrow', 'senthilhsbc']",46,8,5.75
0,no problem baby is this is a good time to talk i called and left a message,"['problem', 'baby', 'good', 'time', 'talk', 'called', 'left', 'message']",74,17,4.352941176470588
0,i have to take exam with march,"['take', 'exam', 'march']",30,7,4.285714285714286
0,rajipls do me a favour pls convey my birthday wishes to nimya pls today is her birthday,"['rajipls', 'favour', 'pls', 'convey', 'birthday', 'wishes', 'nimya', 'pls', 'today', 'birthday']",87,17,5.117647058823529
1,ur balance is now next question complete the landmark big a bob b barry or c ben text a b or c to good luck,"['ur', 'balance', 'next', 'question', 'complete', 'landmark', 'big', 'bob', 'b', 'barry', 'c', 'ben', 'text', 'b', 'c', 'good', 'luck']",107,25,4.28
0,can you just come in for a sec theres somebody here i want you to see,"['come', 'sec', 'theres', 'somebody', 'want', 'see']",69,16,4.3125
0,thanks honey but still havent heard anything i will leave it a bit longer so not crowd him and will try later great advice thanks hope cardiff is still there,"['thanks', 'honey', 'still', 'havent', 'heard', 'anything', 'leave', 'bit', 'longer', 'crowd', 'try', 'later', 'great', 'advice', 'thanks', 'hope', 'cardiff', 'still']",157,30,5.233333333333333
0,thinkin about someone is all good no drugs for that,"['thinkin', 'someone', 'good', 'drugs']",51,10,5.1
0,some friends want me to drive em someplace probably take a while,"['friends', 'want', 'drive', 'em', 'someplace', 'probably', 'take']",64,12,5.333333333333333
0,was just about to ask will keep this one maybe thats why you didnt get all the messages we sent you on glo,"['ask', 'keep', 'one', 'maybe', 'thats', 'didnt', 'get', 'messages', 'sent', 'glo']",106,23,4.608695652173913
0,you can jot down things you want to remember later,"['jot', 'things', 'want', 'remember', 'later']",50,10,5.0
0,first has she gained more than ltgt kg since she took in second has she done the blood sugar tests if she has and its ok and her blood pressure is within normal limits then no worries,"['first', 'gained', 'ltgt', 'kg', 'since', 'took', 'second', 'done', 'blood', 'sugar', 'tests', 'ok', 'blood', 'pressure', 'within', 'normal', 'limits', 'worries']",183,37,4.945945945945946
0,hey anyway i have to,"['hey', 'anyway']",20,5,4.0
0,sfrom the training manual it show there is no tech processits all about password reset and troubleshooting,"['sfrom', 'training', 'manual', 'show', 'tech', 'processits', 'password', 'reset', 'troubleshooting']",106,17,6.235294117647059
0,if you have belive me come to my home,"['belive', 'come', 'home']",37,9,4.111111111111111
1,urgent important information for user today is your lucky day find out why log onto there is a fantastic surprise awaiting you,"['urgent', 'important', 'information', 'user', 'today', 'lucky', 'day', 'find', 'log', 'onto', 'fantastic', 'surprise', 'awaiting']",126,22,5.7272727272727275
0,if u laugh really loud if u talk spontaneously if u dont care what others feel u are probably with your dear amp best friends goodevening dear,"['u', 'laugh', 'really', 'loud', 'u', 'talk', 'spontaneously', 'u', 'dont', 'care', 'others', 'feel', 'u', 'probably', 'dear', 'amp', 'best', 'friends', 'goodevening', 'dear']",142,27,5.2592592592592595
0,can you pls pls send me a mail on all you know about relatives coming to deliver here all you know about costs risks benefits and anything else thanks,"['pls', 'pls', 'send', 'mail', 'know', 'relatives', 'coming', 'deliver', 'know', 'costs', 'risks', 'benefits', 'anything', 'else', 'thanks']",150,29,5.172413793103448
1,you have won a nokia i this is what you get when you win our free auction to take part send nokia to now hgsuitelands rowwjhl,"['nokia', 'get', 'win', 'free', 'auction', 'take', 'part', 'send', 'nokia', 'hgsuitelands', 'rowwjhl']",125,26,4.8076923076923075
0,kkfrom tomorrow onwards started ah,"['kkfrom', 'tomorrow', 'onwards', 'started', 'ah']",34,5,6.8
0,yup i shd haf ard pages if i add figures all got how many pages,"['yup', 'shd', 'haf', 'ard', 'pages', 'add', 'figures', 'got', 'many', 'pages']",63,15,4.2
0,in da car park,"['da', 'car', 'park']",14,4,3.5
1,jamster to get your free wallpaper text heart to now tc apply only need help call,"['jamster', 'get', 'free', 'wallpaper', 'text', 'heart', 'tc', 'apply', 'need', 'help', 'call']",81,16,5.0625
0,yup i thk so until e shop closes lor,"['yup', 'thk', 'e', 'shop', 'closes', 'lor']",36,9,4.0
0,how about clothes jewelry and trips,"['clothes', 'jewelry', 'trips']",35,6,5.833333333333333
1,we tried to contact you re your reply to our offer of mins textand a new video phone call now or reply for free delivery tomorrow,"['tried', 'contact', 'reply', 'offer', 'mins', 'textand', 'new', 'video', 'phone', 'call', 'reply', 'free', 'delivery', 'tomorrow']",129,26,4.961538461538462
0,check maili have mailed varma and kept copy to you regarding membershiptake careinsha allah,"['check', 'maili', 'mailed', 'varma', 'kept', 'copy', 'regarding', 'membershiptake', 'careinsha', 'allah']",91,14,6.5
0,just gettin a bit arty with my collages at the mo well tryin ne way got a roast in a min lovely i shall enjoy that,"['gettin', 'bit', 'arty', 'collages', 'mo', 'well', 'tryin', 'ne', 'way', 'got', 'roast', 'min', 'lovely', 'shall', 'enjoy']",114,26,4.384615384615385
0,cool so how come you havent been wined and dined before,"['cool', 'come', 'havent', 'wined', 'dined']",55,11,5.0
0,oh thats late well have a good night and i will give u a call tomorrow iam now going to go to sleep night night,"['oh', 'thats', 'late', 'well', 'good', 'night', 'give', 'u', 'call', 'tomorrow', 'iam', 'going', 'go', 'sleep', 'night', 'night']",111,25,4.44
0,i jus reached home i go bathe first but my sis using net tell u when she finishes k,"['jus', 'reached', 'home', 'go', 'bathe', 'first', 'sis', 'using', 'net', 'tell', 'u', 'finishes', 'k']",83,19,4.368421052631579
0,so can collect ur laptop,"['collect', 'ur', 'laptop']",24,5,4.8
1,this weeks savamob member offers are now accessible just call for details savamob pobox la wu only week savamob offers mobile,"['weeks', 'savamob', 'member', 'offers', 'accessible', 'call', 'details', 'savamob', 'pobox', 'la', 'wu', 'week', 'savamob', 'offers', 'mobile']",125,21,5.9523809523809526
0,haha can but im having dinner with my cousin,"['haha', 'im', 'dinner', 'cousin']",44,9,4.888888888888889
1,todays voda numbers ending with are selected to receive a reward if you have a match please call quoting claim code standard rates apply,"['todays', 'voda', 'numbers', 'ending', 'selected', 'receive', 'reward', 'match', 'please', 'call', 'quoting', 'claim', 'code', 'standard', 'rates', 'apply']",136,24,5.666666666666667
0,hi darlin i finish at do u pick me up or meet me text back on this number luv kate xxx,"['hi', 'darlin', 'finish', 'u', 'pick', 'meet', 'text', 'back', 'number', 'luv', 'kate', 'xxx']",86,21,4.095238095238095
1,sunshine quiz wkly q win a top sony dvd player if u know which country the algarve is in txt ansr to sptyrone,"['sunshine', 'quiz', 'wkly', 'q', 'win', 'top', 'sony', 'dvd', 'player', 'u', 'know', 'country', 'algarve', 'txt', 'ansr', 'sptyrone']",109,23,4.739130434782608
0,hope you are having a great day,"['hope', 'great', 'day']",31,7,4.428571428571429
1,sms auction a brand new nokia is up auction today auction is free join take part txt nokia to now hgsuitelands rowwjhl,"['sms', 'auction', 'brand', 'new', 'nokia', 'auction', 'today', 'auction', 'free', 'join', 'take', 'part', 'txt', 'nokia', 'hgsuitelands', 'rowwjhl']",118,22,5.363636363636363
0,by the way rencontre is to meet again mountains dont,"['way', 'rencontre', 'meet', 'mountains', 'dont']",52,10,5.2
0,yup hey then one day on fri we can ask miwa and jiayin take leave go karaoke,"['yup', 'hey', 'one', 'day', 'fri', 'ask', 'miwa', 'jiayin', 'take', 'leave', 'go', 'karaoke']",76,17,4.470588235294118
0,are you staying in town,"['staying', 'town']",23,5,4.6
0,what time is ur flight tmr,"['time', 'ur', 'flight', 'tmr']",26,6,4.333333333333333
0,u coming pick me,"['u', 'coming', 'pick']",16,4,4.0
0,howz painhope u r fine,"['howz', 'painhope', 'u', 'r', 'fine']",22,5,4.4
0,i am great princess what are you thinking about me,"['great', 'princess', 'thinking']",50,10,5.0
0,i see when we finish we have loads of loans to pay,"['see', 'finish', 'loads', 'loans', 'pay']",50,12,4.166666666666667
1,urgent we are trying to contact you last weekends draw shows that you have won a prize guaranteed call claim code s valid hrs only,"['urgent', 'trying', 'contact', 'last', 'weekends', 'draw', 'shows', 'prize', 'guaranteed', 'call', 'claim', 'code', 'valid', 'hrs']",130,25,5.2
0,and i dont plan on staying the night but i prolly wont be back til late,"['dont', 'plan', 'staying', 'night', 'prolly', 'wont', 'back', 'til', 'late']",71,16,4.4375
0,yup ok,"['yup', 'ok']",6,2,3.0
0,hello which the site to download songs its urgent pls,"['hello', 'site', 'download', 'songs', 'urgent', 'pls']",53,10,5.3
0,dont necessarily expect it to be done before you get back though because im just now headin out,"['dont', 'necessarily', 'expect', 'done', 'get', 'back', 'though', 'im', 'headin']",95,18,5.277777777777778
0,friendship is not a game to play it is not a word to say it doesnt start on march and ends on may it is tomorrow yesterday today and e,"['friendship', 'game', 'play', 'word', 'say', 'doesnt', 'start', 'march', 'ends', 'may', 'tomorrow', 'yesterday', 'today', 'e']",134,30,4.466666666666667
0,haha better late than ever any way i could swing by,"['haha', 'better', 'late', 'ever', 'way', 'could', 'swing']",51,11,4.636363636363637
