label,message,tokens,message_length,word_count,avg_word_length
0,well join the ltgt bus,"['well', 'join', 'ltgt', 'bus']",22,5,4.4
0,when you are big god will bring success,"['big', 'god', 'bring', 'success']",39,8,4.875
1,send a logo ur lover names joined by a heart txt love name name mobno eg love adam eve to yahoo poboxwwq txtno no ads p,"['send', 'logo', 'ur', 'lover', 'names', 'joined', 'heart', 'txt', 'love', 'name', 'name', 'mobno', 'eg', 'love', 'adam', 'eve', 'yahoo', 'poboxwwq', 'txtno', 'ads', 'p']",119,26,4.576923076923077
0,kinda first one gets in at twelve aah speak tomo,"['kinda', 'first', 'one', 'gets', 'twelve', 'aah', 'speak', 'tomo']",48,10,4.8
0,was actually about to send you a reminder today have a wonderful weekend,"['actually', 'send', 'reminder', 'today', 'wonderful', 'weekend']",72,13,5.538461538461538
0,having lunchyou are not in onlinewhy,"['lunchyou', 'onlinewhy']",36,6,6.0
0,now only i reached home i am very tired now i will come tomorro,"['reached', 'home', 'tired', 'come', 'tomorro']",63,14,4.5
0,dude sux for snake he got old and raiden got buff,"['dude', 'sux', 'snake', 'got', 'old', 'raiden', 'got', 'buff']",49,11,4.454545454545454
0,yo you around just got my car back,"['yo', 'around', 'got', 'car', 'back']",34,8,4.25
0,send me your resume,"['send', 'resume']",19,4,4.75
0,hmmmbut you should give it on one day,"['hmmmbut', 'give', 'one', 'day']",37,8,4.625
0,awesome that gonna be soon or later tonight,"['awesome', 'gon', 'na', 'soon', 'later', 'tonight']",43,8,5.375
0,are you going to wipro interview today,"['going', 'wipro', 'interview', 'today']",38,7,5.428571428571429
0,no go no openings for that room til after thanksgiving without an upcharge,"['go', 'openings', 'room', 'til', 'thanksgiving', 'without', 'upcharge']",74,13,5.6923076923076925
0,hmm well night night,"['hmm', 'well', 'night', 'night']",20,4,5.0
0,you got job in wiproyou will get every thing in life in or years,"['got', 'job', 'wiproyou', 'get', 'every', 'thing', 'life', 'years']",64,14,4.571428571428571
1,eerie nokia tones u rply tone title to eg tone dracula to titles ghost addamsfa munsters exorcist twilight wwwgetzedcouk poboxwwq p,"['eerie', 'nokia', 'tones', 'u', 'rply', 'tone', 'title', 'eg', 'tone', 'dracula', 'titles', 'ghost', 'addamsfa', 'munsters', 'exorcist', 'twilight', 'wwwgetzedcouk', 'poboxwwq', 'p']",131,21,6.238095238095238
0,all day working dayexcept saturday and sunday,"['day', 'working', 'dayexcept', 'saturday', 'sunday']",45,7,6.428571428571429
1,you have an important customer service announcement call freephone now,"['important', 'customer', 'service', 'announcement', 'call', 'freephone']",70,10,7.0
0,you know wot people wear t shirts jumpers hat belt is all we know we r at cribbs,"['know', 'wot', 'people', 'wear', 'shirts', 'jumpers', 'hat', 'belt', 'know', 'r', 'cribbs']",80,18,4.444444444444445
0,er mw im filled tuth is aight,"['er', 'mw', 'im', 'filled', 'tuth', 'aight']",29,7,4.142857142857143
1,double mins txts on orange tariffs latest motorola sonyericsson nokia with bluetooth free call mobileupd on or calloptouthf,"['double', 'mins', 'txts', 'orange', 'tariffs', 'latest', 'motorola', 'sonyericsson', 'nokia', 'bluetooth', 'free', 'call', 'mobileupd', 'calloptouthf']",123,18,6.833333333333333
0,and that is the problem you walk around in julianaland oblivious to what is going on around you i say the same things constantly and they go in one ear and out the other while you go off doing whatever you want to do its not that you dont know why im upsetits that you dont listen when i tell you what is going to upset me then you want to be surprised when im mad,"['problem', 'walk', 'around', 'julianaland', 'oblivious', 'going', 'around', 'say', 'things', 'constantly', 'go', 'one', 'ear', 'go', 'whatever', 'want', 'dont', 'know', 'im', 'upsetits', 'dont', 'listen', 'tell', 'going', 'upset', 'want', 'surprised', 'im', 'mad']",364,76,4.7894736842105265
0,and also ive sorta blown him off a couple times recently so id rather not text him out of the blue looking for weed,"['also', 'ive', 'sorta', 'blown', 'couple', 'times', 'recently', 'id', 'rather', 'text', 'blue', 'looking', 'weed']",115,24,4.791666666666667
0,just sleepingand surfing,"['sleepingand', 'surfing']",24,3,8.0
0,you at mu you should try to figure out how much money everyone has for gas and alcohol jay and i are trying to figure out our weed budget,"['mu', 'try', 'figure', 'much', 'money', 'everyone', 'gas', 'alcohol', 'jay', 'trying', 'figure', 'weed', 'budget']",137,29,4.724137931034483
1,reminder you have not downloaded the content you have already paid for goto mymoby tv to collect your content,"['reminder', 'downloaded', 'content', 'already', 'paid', 'goto', 'mymoby', 'tv', 'collect', 'content']",109,19,5.7368421052631575
0,ok thanx take care then,"['ok', 'thanx', 'take', 'care']",23,5,4.6
0,really i tot ur paper ended long ago but wat u copied jus now got use u happy lar i still haf study,"['really', 'tot', 'ur', 'paper', 'ended', 'long', 'ago', 'wat', 'u', 'copied', 'jus', 'got', 'use', 'u', 'happy', 'lar', 'still', 'haf', 'study']",99,23,4.304347826086956
0,yeah i am so ill leave maybe ish,"['yeah', 'ill', 'leave', 'maybe', 'ish']",32,8,4.0
0,hi darlin how was work did u get into trouble ijust talked to your mum all morning i had a really good time last night im goin out soon but call me if u can,"['hi', 'darlin', 'work', 'u', 'get', 'trouble', 'ijust', 'talked', 'mum', 'morning', 'really', 'good', 'time', 'last', 'night', 'im', 'goin', 'soon', 'call', 'u']",156,35,4.457142857142857
0,let there be snow let there be snow this kind of weather brings ppl together so friendships can grow,"['let', 'snow', 'let', 'snow', 'kind', 'weather', 'brings', 'ppl', 'together', 'friendships', 'grow']",100,19,5.2631578947368425
1,this is the nd time we have tried to contact u u have won the prize claim is easy just call now only p per minute btnationalrate,"['nd', 'time', 'tried', 'contact', 'u', 'u', 'prize', 'claim', 'easy', 'call', 'p', 'per', 'minute', 'btnationalrate']",128,27,4.7407407407407405
0,haha but no money leh later got to go for tuition haha and looking for empty slots for driving lessons,"['haha', 'money', 'leh', 'later', 'got', 'go', 'tuition', 'haha', 'looking', 'empty', 'slots', 'driving', 'lessons']",102,20,5.1
1,romantic paris nights flights from book now next year call tscs apply,"['romantic', 'paris', 'nights', 'flights', 'book', 'next', 'year', 'call', 'tscs', 'apply']",69,12,5.75
0,how dare you change my ring,"['dare', 'change', 'ring']",27,6,4.5
0,you tell what happen dont behave like this to me ok no need to say,"['tell', 'happen', 'dont', 'behave', 'like', 'ok', 'need', 'say']",66,15,4.4
0,thanx yup we coming back on sun finish dinner going back hotel now time flies were tog exactly a mth today hope well haf many more mths to come,"['thanx', 'yup', 'coming', 'back', 'sun', 'finish', 'dinner', 'going', 'back', 'hotel', 'time', 'flies', 'tog', 'exactly', 'mth', 'today', 'hope', 'well', 'haf', 'many', 'mths', 'come']",143,29,4.931034482758621
0,eh ur laptop got no stock lei he say mon muz come again to take a look c got a not,"['eh', 'ur', 'laptop', 'got', 'stock', 'lei', 'say', 'mon', 'muz', 'come', 'take', 'look', 'c', 'got']",82,21,3.9047619047619047
0,sorry vikky im watching olave mandara movie kano in trishul theatre wit my frnds,"['sorry', 'vikky', 'im', 'watching', 'olave', 'mandara', 'movie', 'kano', 'trishul', 'theatre', 'wit', 'frnds']",80,14,5.714285714285714
1,sms auction you have won a nokia i this is what you get when you win our free auction to take part send nokia to now hgsuitelands rowwjhl,"['sms', 'auction', 'nokia', 'get', 'win', 'free', 'auction', 'take', 'part', 'send', 'nokia', 'hgsuitelands', 'rowwjhl']",137,28,4.892857142857143
0,i have lost kilos as of today,"['lost', 'kilos', 'today']",29,7,4.142857142857143
0,just sent you an email to an address with incomm in it is that right,"['sent', 'email', 'address', 'incomm', 'right']",68,15,4.533333333333333
1,sms services for your inclusive text credits pls goto wwwcomuknet login qxj unsubscribe with stop no extra charge help comuk cm ae,"['sms', 'services', 'inclusive', 'text', 'credits', 'pls', 'goto', 'wwwcomuknet', 'login', 'qxj', 'unsubscribe', 'stop', 'extra', 'charge', 'help', 'comuk', 'cm', 'ae']",130,22,5.909090909090909
0,lol well dont do it without me we could have a big sale together,"['lol', 'well', 'dont', 'without', 'could', 'big', 'sale', 'together']",64,14,4.571428571428571
0,oh great ill disturb him more so that we can talk,"['oh', 'great', 'ill', 'disturb', 'talk']",49,11,4.454545454545454
0,gud niswt drmstake care,"['gud', 'niswt', 'drmstake', 'care']",23,4,5.75
0,am i that much bad to avoid like this,"['much', 'bad', 'avoid', 'like']",37,9,4.111111111111111
0,so that takes away some money worries,"['takes', 'away', 'money', 'worries']",37,7,5.285714285714286
0,dont forget though that i love you and i walk beside you watching over you and keeping your heart warm,"['dont', 'forget', 'though', 'love', 'walk', 'beside', 'watching', 'keeping', 'heart', 'warm']",102,20,5.1
1,themob check out our newest selection of content games tones gossip babes and sport keep your mobile fit and funky text wap to,"['themob', 'check', 'newest', 'selection', 'content', 'games', 'tones', 'gossip', 'babes', 'sport', 'keep', 'mobile', 'fit', 'funky', 'text', 'wap']",126,23,5.478260869565218
0,i think your mentor is but not percent sure,"['think', 'mentor', 'percent', 'sure']",43,9,4.777777777777778
1,interflora its not too late to order interflora flowers for christmas call to place your order before midnight tomorrow,"['interflora', 'late', 'order', 'interflora', 'flowers', 'christmas', 'call', 'place', 'order', 'midnight', 'tomorrow']",119,19,6.2631578947368425
0,wat would u like ur birthday,"['wat', 'would', 'u', 'like', 'ur', 'birthday']",28,6,4.666666666666667
0,am in film ill call you later,"['film', 'ill', 'call', 'later']",29,7,4.142857142857143
0,babe how goes that day what are you doing where are you i sip my cappuccino and think of you my love i send a kiss to you from across the sea,"['babe', 'goes', 'day', 'sip', 'cappuccino', 'think', 'love', 'send', 'kiss', 'across', 'sea']",141,32,4.40625
0,cant i feel nauseous im so pissed i didnt eat any sweets all week cause today i was planning to pig out i was dieting all week and now im not hungry,"['cant', 'feel', 'nauseous', 'im', 'pissed', 'didnt', 'eat', 'sweets', 'week', 'cause', 'today', 'planning', 'pig', 'dieting', 'week', 'im', 'hungry']",148,32,4.625
0,no messages on her phone im holding it now,"['messages', 'phone', 'im', 'holding']",42,9,4.666666666666667
0,haha i think i did too,"['haha', 'think']",22,6,3.6666666666666665
0,what time im out until prob or so,"['time', 'im', 'prob']",33,8,4.125
1,urgent your mobile number has been awarded with a prize guaranteed call from land line claim valid hrs only,"['urgent', 'mobile', 'number', 'awarded', 'prize', 'guaranteed', 'call', 'land', 'line', 'claim', 'valid', 'hrs']",107,19,5.631578947368421
0,pls speak with me i wont ask anything other then you friendship,"['pls', 'speak', 'wont', 'ask', 'anything', 'friendship']",63,12,5.25
0,my mobile numberpls sms ur mail idconvey regards to achanammarakheshqatar,"['mobile', 'numberpls', 'sms', 'ur', 'mail', 'idconvey', 'regards', 'achanammarakheshqatar']",73,10,7.3
0,he dint tell anything he is angry on me that why you told to abi,"['dint', 'tell', 'anything', 'angry', 'told', 'abi']",64,15,4.266666666666667
0,i cant wait to see you how were the photos were useful,"['cant', 'wait', 'see', 'photos', 'useful']",54,12,4.5
0,new car and house for my parentsi have only new job in hand,"['new', 'car', 'house', 'parentsi', 'new', 'job', 'hand']",59,13,4.538461538461538
0,let me know how to contact you ive you settled in a room lets know you are ok,"['let', 'know', 'contact', 'ive', 'settled', 'room', 'lets', 'know', 'ok']",77,18,4.277777777777778
1,bought one ringtone and now getting texts costing pound offering more tones etc,"['bought', 'one', 'ringtone', 'getting', 'texts', 'costing', 'pound', 'offering', 'tones', 'etc']",79,13,6.076923076923077
0,hi its jess i dont know if you are at work but call me when u can im at home all eve xxx,"['hi', 'jess', 'dont', 'know', 'work', 'call', 'u', 'im', 'home', 'eve', 'xxx']",88,23,3.8260869565217392
0,wah okie okie muz make use of e unlimited haha,"['wah', 'okie', 'okie', 'muz', 'make', 'use', 'e', 'unlimited', 'haha']",46,10,4.6
0,were trying to find a chinese food place around here,"['trying', 'find', 'chinese', 'food', 'place', 'around']",52,10,5.2
0,i think asking for a gym is the excuse for lazy people i jog,"['think', 'asking', 'gym', 'excuse', 'lazy', 'people', 'jog']",60,14,4.285714285714286
0,am on a train back from northampton so im afraid not im staying skyving off today ho ho will be around wednesday though do you fancy the comedy club this week by the way,"['train', 'back', 'northampton', 'im', 'afraid', 'im', 'staying', 'skyving', 'today', 'ho', 'ho', 'around', 'wednesday', 'though', 'fancy', 'comedy', 'club', 'week', 'way']",169,34,4.970588235294118
0,okie but i scared u say i fat then u dun wan me already,"['okie', 'scared', 'u', 'say', 'fat', 'u', 'dun', 'wan', 'already']",55,14,3.9285714285714284
1,someonone you know is trying to contact you via our dating service to find out who it could be call from your mobile or landline boxskch,"['someonone', 'know', 'trying', 'contact', 'via', 'dating', 'service', 'find', 'could', 'call', 'mobile', 'landline', 'boxskch']",136,26,5.230769230769231
0,and dont worry well have finished by march ish,"['dont', 'worry', 'well', 'finished', 'march', 'ish']",46,9,5.111111111111111
0,eat jap done oso aft ur lect wat got lect at rite,"['eat', 'jap', 'done', 'oso', 'aft', 'ur', 'lect', 'wat', 'got', 'lect', 'rite']",49,12,4.083333333333333
0,just sing hu i think its also important to find someone female that know the place well preferably a citizen that is also smart to help you navigate through even things like choosing a phone plan require guidance when in doubt ask especially girls,"['sing', 'hu', 'think', 'also', 'important', 'find', 'someone', 'female', 'know', 'place', 'well', 'preferably', 'citizen', 'also', 'smart', 'help', 'navigate', 'even', 'things', 'like', 'choosing', 'phone', 'plan', 'require', 'guidance', 'doubt', 'ask', 'especially', 'girls']",247,44,5.613636363636363
0,life spend with someone for a lifetime may be meaningless but a few moments spent with someone who really love you means more than life itself,"['life', 'spend', 'someone', 'lifetime', 'may', 'meaningless', 'moments', 'spent', 'someone', 'really', 'love', 'means', 'life']",142,26,5.461538461538462
0,whats that coming over the hill is it a monster hope you have a great day things r going fine here busy though,"['whats', 'coming', 'hill', 'monster', 'hope', 'great', 'day', 'things', 'r', 'going', 'fine', 'busy', 'though']",110,23,4.782608695652174
0,god picked up a flower and dippeditinadew lovingly touched itwhichturnedinto u and the he gifted tomeandsaidthis friend is u,"['god', 'picked', 'flower', 'dippeditinadew', 'lovingly', 'touched', 'itwhichturnedinto', 'u', 'gifted', 'tomeandsaidthis', 'friend', 'u']",124,19,6.526315789473684
0,lol oh you got a friend for the dog,"['lol', 'oh', 'got', 'friend', 'dog']",35,9,3.888888888888889
0,jay says that youre a doublefaggot,"['jay', 'says', 'youre', 'doublefaggot']",34,6,5.666666666666667
1,todays vodafone numbers ending with my last four digits are selected to received a award if your number matches please call to claim your award,"['todays', 'vodafone', 'numbers', 'ending', 'last', 'four', 'digits', 'selected', 'received', 'award', 'number', 'matches', 'please', 'call', 'claim', 'award']",143,25,5.72
1,free polyphonic ringtone text super to to get your free poly tone of the week now sn pobox nr zs subscription pw,"['free', 'polyphonic', 'ringtone', 'text', 'super', 'get', 'free', 'poly', 'tone', 'week', 'sn', 'pobox', 'nr', 'zs', 'subscription', 'pw']",112,22,5.090909090909091
0,be sure to check your yahoo email we sent photos yesterday,"['sure', 'check', 'yahoo', 'email', 'sent', 'photos', 'yesterday']",58,11,5.2727272727272725
0,cool breeze bright sun fresh flower twittering birds all these waiting to wish u goodmorning amp have a nice day,"['cool', 'breeze', 'bright', 'sun', 'fresh', 'flower', 'twittering', 'birds', 'waiting', 'wish', 'u', 'goodmorning', 'amp', 'nice', 'day']",112,20,5.6
0,check audreys status right now,"['check', 'audreys', 'status', 'right']",30,5,6.0
0,haha awesome ive been to u a couple times who alls coming,"['haha', 'awesome', 'ive', 'u', 'couple', 'times', 'alls', 'coming']",57,12,4.75
0,sif we have one good partnership going we will take lead,"['sif', 'one', 'good', 'partnership', 'going', 'take', 'lead']",56,11,5.090909090909091
0,be happy there i will come after noon,"['happy', 'come', 'noon']",37,8,4.625
0,mine here like all fr china then so noisy,"['mine', 'like', 'fr', 'china', 'noisy']",41,9,4.555555555555555
0,in the end she might still vomit but its okay not everything will come out,"['end', 'might', 'still', 'vomit', 'okay', 'everything', 'come']",74,15,4.933333333333334
0,havent seen my facebook huh lol,"['havent', 'seen', 'facebook', 'huh', 'lol']",31,6,5.166666666666667
0,hes really into skateboarding now despite the fact that he gets thrown off of it and winds up with bandages and shit all over his arms every five minutes,"['hes', 'really', 'skateboarding', 'despite', 'fact', 'gets', 'thrown', 'winds', 'bandages', 'shit', 'arms', 'every', 'five', 'minutes']",153,29,5.275862068965517
0,but you were together so you should be thinkin about him,"['together', 'thinkin']",56,11,5.090909090909091
0,oh howda gud gud mathe en samachara chikku,"['oh', 'howda', 'gud', 'gud', 'mathe', 'en', 'samachara', 'chikku']",42,8,5.25
0,k so am i how much for an th fifty,"['k', 'much', 'th', 'fifty']",34,10,3.4
0,yeshe is really greatbhaji told kallis best cricketer after sachin in worldvery tough to get out,"['yeshe', 'really', 'greatbhaji', 'told', 'kallis', 'best', 'cricketer', 'sachin', 'worldvery', 'tough', 'get']",96,16,6.0
1,hi its lucy hubby at meetins all day fri i will b alone at hotel u fancy cumin over pls leave msg day lucy x callsminmobsmorelkpoboxhpfl,"['hi', 'lucy', 'hubby', 'meetins', 'day', 'fri', 'b', 'alone', 'hotel', 'u', 'fancy', 'cumin', 'pls', 'leave', 'msg', 'day', 'lucy', 'x', 'callsminmobsmorelkpoboxhpfl']",136,26,5.230769230769231
0,i ask if u meeting da ge tmr nite,"['ask', 'u', 'meeting', 'da', 'ge', 'tmr', 'nite']",33,9,3.6666666666666665
0,well theres still a bit left if you guys want to tonight,"['well', 'theres', 'still', 'bit', 'left', 'guys', 'want', 'tonight']",56,12,4.666666666666667
0,no im good for the movie is it ok if i leave in an hourish,"['im', 'good', 'movie', 'ok', 'leave', 'hourish']",58,15,3.8666666666666667
1,accordingly i repeat just text the word ok on your mobile phone and send,"['accordingly', 'repeat', 'text', 'word', 'ok', 'mobile', 'phone', 'send']",72,14,5.142857142857143
1,free for st week no nokia tone ur mob every week just txt nokia to get txting and tell ur mates wwwgetzedcouk pobox w wq norm ptone,"['free', 'st', 'week', 'nokia', 'tone', 'ur', 'mob', 'every', 'week', 'txt', 'nokia', 'get', 'txting', 'tell', 'ur', 'mates', 'wwwgetzedcouk', 'pobox', 'w', 'wq', 'norm', 'ptone']",131,27,4.851851851851852
1,we currently have a message awaiting your collection to collect your message just call,"['currently', 'message', 'awaiting', 'collection', 'collect', 'message', 'call']",86,14,6.142857142857143
0,or u ask they all if next sat can a not if all of them can make it then im ok lor,"['u', 'ask', 'next', 'sat', 'make', 'im', 'ok', 'lor']",81,22,3.6818181818181817
0,imagine you finally get to sink into that bath after i have put you through your paces maybe even having you eat me for a while before i left but also imagine the feel of that cage on your cock surrounded by the bath water reminding you always who owns you enjoy my cuck,"['imagine', 'finally', 'get', 'sink', 'bath', 'put', 'paces', 'maybe', 'even', 'eat', 'left', 'also', 'imagine', 'feel', 'cage', 'cock', 'surrounded', 'bath', 'water', 'reminding', 'always', 'owns', 'enjoy', 'cuck']",270,54,5.0
0,haha sounds crazy dunno can tahan anot,"['haha', 'sounds', 'crazy', 'dunno', 'tahan', 'anot']",38,7,5.428571428571429
0,yeah thatd pretty much be the best case scenario,"['yeah', 'thatd', 'pretty', 'much', 'best', 'case', 'scenario']",48,9,5.333333333333333
0,which channel,['channel'],13,2,6.5
0,i am not having her number sir,"['number', 'sir']",30,7,4.285714285714286
0,hello hello hi lou sorry it took so long reply i left mobile at friends in lancaster just got it bak neway im sorry i couldnt make ur bday hun,"['hello', 'hello', 'hi', 'lou', 'sorry', 'took', 'long', 'reply', 'left', 'mobile', 'friends', 'lancaster', 'got', 'bak', 'neway', 'im', 'sorry', 'couldnt', 'make', 'ur', 'bday', 'hun']",142,30,4.733333333333333
0,dai what this da can i send my resume to this id,"['dai', 'da', 'send', 'resume', 'id']",48,12,4.0
0,im going orchard now laready me reaching soon u reaching,"['im', 'going', 'orchard', 'laready', 'reaching', 'soon', 'u', 'reaching']",56,10,5.6
1,not heard from u a while call rude chat private line to cum wan c pics of me gettin shagged then text pix to end send stop sam xxx,"['heard', 'u', 'call', 'rude', 'chat', 'private', 'line', 'cum', 'wan', 'c', 'pics', 'gettin', 'shagged', 'text', 'pix', 'end', 'send', 'stop', 'sam', 'xxx']",130,29,4.482758620689655
0,yeah sure ill leave in a min,"['yeah', 'sure', 'ill', 'leave', 'min']",28,7,4.0
0,and of course you should make a stink,"['course', 'make', 'stink']",37,8,4.625
0,speak only when you feel your words are better than the silence gud mrng,"['speak', 'feel', 'words', 'better', 'silence', 'gud', 'mrng']",72,14,5.142857142857143
1,a xmas reward is waiting for you our computer has randomly picked you from our loyal mobile customers to receive a reward just call,"['xmas', 'reward', 'waiting', 'computer', 'randomly', 'picked', 'loyal', 'mobile', 'customers', 'receive', 'reward', 'call']",131,24,5.458333333333333
0,good morning pookie pie lol hope i didnt wake u up,"['good', 'morning', 'pookie', 'pie', 'lol', 'hope', 'didnt', 'wake', 'u']",50,11,4.545454545454546
0,ok cool see ya then,"['ok', 'cool', 'see', 'ya']",19,5,3.8
0,just sent again do you scream and moan in bed princess,"['sent', 'scream', 'moan', 'bed', 'princess']",54,11,4.909090909090909
0,ill let you know when it kicks in,"['ill', 'let', 'know', 'kicks']",33,8,4.125
0,what is the plural of the noun research,"['plural', 'noun', 'research']",39,8,4.875
0,in e msg jus now u said thanks for gift,"['e', 'msg', 'jus', 'u', 'said', 'thanks', 'gift']",39,10,3.9
1,sex up ur mobile with a free sexy pic of jordan just text babe to then every wk get a sexy celeb pocketbabecouk more pics wk,"['sex', 'ur', 'mobile', 'free', 'sexy', 'pic', 'jordan', 'text', 'babe', 'every', 'wk', 'get', 'sexy', 'celeb', 'pocketbabecouk', 'pics', 'wk']",124,26,4.769230769230769
1,call from tells u call to claim prize u have enter all ur mobile personal details the prompts careful,"['call', 'tells', 'u', 'call', 'claim', 'prize', 'u', 'enter', 'ur', 'mobile', 'personal', 'details', 'prompts', 'careful']",101,19,5.315789473684211
0,how u doin baby girl hope u are okay every time i call ure phone is off i miss u get in touch,"['u', 'doin', 'baby', 'girl', 'hope', 'u', 'okay', 'every', 'time', 'call', 'ure', 'phone', 'miss', 'u', 'get', 'touch']",93,23,4.043478260869565
0,also maaaan are you missing out,"['also', 'maaaan', 'missing']",31,6,5.166666666666667
1,get ur st ringtone free now reply to this msg with tone gr top tones to your phone every week just per wk opt out send stop,"['get', 'ur', 'st', 'ringtone', 'free', 'reply', 'msg', 'tone', 'gr', 'top', 'tones', 'phone', 'every', 'week', 'per', 'wk', 'opt', 'send', 'stop']",123,27,4.555555555555555
0,u goin out nite,"['u', 'goin', 'nite']",15,4,3.75
0,is xy in ur car when u picking me up,"['xy', 'ur', 'car', 'u', 'picking']",36,10,3.6
0,pls send me the correct name da,"['pls', 'send', 'correct', 'name', 'da']",31,7,4.428571428571429
0,thanx u darlinim cool thanx a few bday drinks nite morrow off take care c u soonxxx,"['thanx', 'u', 'darlinim', 'cool', 'thanx', 'bday', 'drinks', 'nite', 'morrow', 'take', 'care', 'c', 'u', 'soonxxx']",83,17,4.882352941176471
0,are you going to write ccna exam this week,"['going', 'write', 'ccna', 'exam', 'week']",42,9,4.666666666666667
0,k can that happen tonight,"['k', 'happen', 'tonight']",25,5,5.0
0,how is it possible to teach you and where,"['possible', 'teach']",41,9,4.555555555555555
0,then she buying today no need to c meh,"['buying', 'today', 'need', 'c', 'meh']",38,9,4.222222222222222
0,have a safe trip to nigeria wish you happiness and very soon company to share moments with,"['safe', 'trip', 'nigeria', 'wish', 'happiness', 'soon', 'company', 'share', 'moments']",90,17,5.294117647058823
0,do u want meet up morro,"['u', 'want', 'meet', 'morro']",23,6,3.8333333333333335
0,sorry about earlier putting out firesare you around to talk after or do you actually have a life lol,"['sorry', 'earlier', 'putting', 'firesare', 'around', 'talk', 'actually', 'life', 'lol']",100,19,5.2631578947368425
0,hope youre not having too much fun without me see u tomorrow love jess x,"['hope', 'youre', 'much', 'fun', 'without', 'see', 'u', 'tomorrow', 'love', 'jess', 'x']",72,15,4.8
0,erutupalam thandiyachu,"['erutupalam', 'thandiyachu']",22,2,11.0
0,oops got that bit,"['oops', 'got', 'bit']",17,4,4.25
0,i am literally in bed and have been up for like ltgt hours,"['literally', 'bed', 'like', 'ltgt', 'hours']",58,13,4.461538461538462
